TAP_service,table_name,objects,description
VizieR,V/164/dr5,400789,"LAMOST DR5 catalog (04/07/2019 version) ( Luo A.-L., Zhao Y.-H., Zhao G., et al.)"
VizieR,V/156/dr7slrs,301985,"LAMOST LRS A, F, G and K Star Catalog ( Luo A.-L., Zhao Y.-H., Zhao G., et al.)"
VizieR,III/283/ravedr6,269792,"RAVE DR6 master file and classification and observation diagnostic data (ravedr6.dr6_sparv, ravedr6.dr6_classification and ravedr6.dr6_obsdata) ( Steinmetz M., Matijevic G., Enke H., et al.)"
VizieR,VII/250/parent,219392,"Details of source observations ( Colless M., Dalton G., Maddox S., et al.)"
VizieR,J/MNRAS/474/4151/wigglez,177649,"The WiggleZ catalogue ( Drinkwater M.J., Byrne Z.J., Blake C., et al.)"
VizieR,V/149/dr2,161237,"LAMOST DR2 catalog (30/06/2016 version) ( Luo A.-L., Zhao Y.-H., Zhao G., et al.)"
VizieR,III/284/allvis,95969,"Time series radial velocities (allVisit; ASCAP version l33, release 12) ( Jonsson H., Holtzman J.A., Allende Prieto C., et al.)"
VizieR,VII/250/2dfgrs,92891,"Best observations of 2dFGRS ( Colless M., Dalton G., Maddox S., et al.)"
VizieR,III/249/catalog,87491,"Stellar radial velocities bibliographic catalogue, 2012 version ( Malaroda S., Levato H., Galliani S.)"
VizieR,J/MNRAS/474/3875/gamadr3,50743,"GAMA-DR3 spectrum catalog ( Baldry I.K., Liske J., Brown M.J.I., et al.)"
VizieR,J/A+A/562/A23/spectro,41649,"VIPERS spectroscopic catalog in the CFHTLS W1 and W4 fields ( Garilli B., Guzzo L., Scodeggio M., et al.)"
VizieR,V/156/dr7aslrs,35946,"LAMOST LRS A Star Catalog ( Luo A.-L., Zhao Y.-H., Zhao G., et al.)"
VizieR,J/ApJ/890/7/table2,30863,"Density field measurements ( Chartab N., Mobasher B., Darvish B., Finkelstein S., Guo Y., Kodra D., Lee K.-S., Newman J.A., Pacifici C., Papovich C., Sattari Z., Shahidi A., Dickinson M.E., Faber S.M., Ferguson H.C., Giavalisco M., Jafariyazani M.)"
VizieR,J/MNRAS/452/2087/tiling,28681,"Science targets and information for tiling and spectroscopic observation (InputCatA V16) ( Liske J., Baldry I.K., Driver S.P., et al.)"
VizieR,J/AN/327/365/grGal,27802,"Catalogue of the 2dF GRS galaxies in the groups ( Tago E., Einasto J., Saar E., Einasto M., Suhhonenko I., Joeveer M., Vennik J., Heinamaki P., Tucker D.L.)"
HEASARC,sdssquasar,27787,Sloan Digital Sky Survey Quasar Catalog (Twelfth Data Release: D
VizieR,J/MNRAS/462/3146/hdr1cat,25173,"HATLAS DR1 Catalogue ( Valiante E., Smith M.W.L., Eales S., Maddox S.J., Ibar E., Hopwood R., Dunne L., Cigan P.J., Dye S., Pascale E., Rigby E.E., Bourne N., Furlanetto C., Ivison R.J.)"
VizieR,VII/203/catalog,23609,"Redshift catalog (Table 3) ( Shectman S.A., Landy S.D., Oemler A., Tucker D.L., Lin H., Kirshner R.P., Schechter P.L.)"
VizieR,III/283/xgaia2,21575,"Rave DR6 cross-match with Gaia DR2 (ravedr6.dr6_x_gaiadr2) ( Steinmetz M., Matijevic G., Enke H., et al.)"
HEASARC,milliquas,21427,"Million Quasars Catalog (MILLIQUAS), Version 7.7 (15 October 202"
VizieR,J/A+A/624/A145/lqac5,19342,"5th release of LQAC5 ( Souchay J., Gattano C., Andrei A.H., Souami D., Coelho B., Barache C., Taris F., Secrest N., Berthereau A.)"
VizieR,V/156/dr7lrs,17414,"LAMOST LRS General Catalog ( Luo A.-L., Zhao Y.-H., Zhao G., et al.)"
VizieR,IX/52/xxlngal,16037,"Spectrophotometric catalog of galaxies (Paper XXII Guglielmo et al. 2018A&A...620A...7G) ( Chiappetti L., Pierre M., Adami C., et al.)"
VizieR,J/A+A/495/53/catalog,15486,"Emission-line measurements, spectral indices, and derived physical properties of galaxies observed in the VIMOS/VLT Deep Survey (VVDS) ( Lamareille F., Brinchmann J., Contini T., et al.)"
VizieR,J/AJ/141/97/catalog,13559,"The catalog of spectroscopic M dwarfs ( West A.A., Morgan D.P., Bochanski J.J., et al.)"
VizieR,J/MNRAS/462/2980/table1,13173,"Catalog of CIV narrow absorption line systems ( Chen Z.-F., Gu Q.-S., Zhou L., Chen Y.-M.)"
VizieR,J/MNRAS/348/866/2dfsgpga,12681,"Galaxies used for group-finding in the SGP ( Eke V.R., Baugh C.M., Cole S., et al.)"
VizieR,J/MNRAS/348/866/2dfngpga,11693,"Galaxies used for group-finding in the NGP ( Eke V.R., Baugh C.M., Cole S., et al.)"
VizieR,VII/249/spectra,11347,"Table of spectral observations (subset of parameters) ( Jones D.H., Saunders W., Read M., Colless M.)"
VizieR,VII/259/spectra,11221,"Table of spectral observations ( Jones D.H., Read M.A., Saunders W., et al.)"
VizieR,III/268/deep2all,10856,"All observations (is a superset of deep2dr4) ( Matthews D.J., Newman J.A., Coil A.L., Cooper M.C., Gwyn S.D.J.)"
VizieR,III/184/catalog,9934,"Third bibliographic catalogue of stellar radial velocities ( Barbier-Brossat M., Petit M., Figon P.)"
VizieR,J/A+A/638/A27/database,9932,"*Individual measurements of radial velocities of the 10702 galaxies (table2) ( Quintana H., Proust D., Dunner R., Carrasco E.R., Reisenegger A.)"
VizieR,J/A+A/530/A31/table1,9254,"Parameters from the RAVE pipeline for all fields ( Lane R.R., Kiss L.L., Lewis G.F., Ibata R.A., Siebert A., Bedding T.R., Szekely P., Szabo G.M.)"
VizieR,J/MNRAS/472/273/ozdesdr1,9172,"Positions, redshifts, redshifts quality flags ( Childress M.J., Lidman C., Davis T.M., et al.)"
VizieR,J/ApJS/235/36/catalog,8983,"SPLASH SXDF v1.6 catalog ( Mehta V., Scarlata C., Capak P., et al.)"
VizieR,V/137D/XHIP,7935,"XHIP catalog: astrometry, spectrography, space motions, exoplanets, photometry, and references ( Anderson E., Francis C.)"
VizieR,J/A+A/602/A100/table2,7671,"Catalog of galaxy groups ( Tempel E., Tuvikene T., Kipper R., Libeskind N.I.)"
VizieR,J/MNRAS/455/2440/catalog,6444,"General catalog data (band-independent data) (UPenn_PhotDec_CAST) ( Meert A., Vikram V., Bernardi M.)"
VizieR,J/A+A/588/A14/table4,6329,"Catalog of combined dataset groups ( Tempel E., Kipper R., Tamm A., Gramann M., Einasto M., Sepp T., Tuvikene T.)"
VizieR,J/ApJS/221/32/table1,6119,"Catalog of Mg II absorption systems ( Chen Z.-F., Gu Q.-S., Chen Y.-M.)"
VizieR,J/A+A/661/A3/ctpmain,5963,"Counterparts for eROSITA sources in Main catalog of Brunner et al., 2022A&A...611A...1B, Cat. J/A+A/661/A1 ( Salvato M., Wolf J., Dwelly T., et al.)"
VizieR,J/ApJS/183/295/catalog,5684,"Photometry, redshifts and rest-frame photometry catalog ( Taylor E.N., Franx M., Van Dokkum P.G., et al.)"
VizieR,J/AJ/116/1/galaxies,5329,"Catalog of galaxies in the SSRS2 sample,  plus 57 galaxies fainter than m_SSRS2_=15.5mag ( Da Costa L.N., Willmer C.N.A., Pellegrini P.S., Chaves O.L., Rite C., Maia M.A.G., Geller M.J., Latham D.W., Kurtz M.J., Huchra J.P., Ramella M., Fairall A.P., Smith C., Lipari S.)"
VizieR,J/A+A/599/A81/table4,5254,"Redshifts for 17985 galaxies ( Moretti A., Gullieuszik M., Poggianti B., Paccagnella A., Couch W.J., Vulcani B., Bettoni D., Fritz J., Cava A., Fasaano G., D'Onofrio M., Omizzolo A.)"
HEASARC,vlacosxoid,4991,VLA-COSMOS 3-GHz Large Project Multiwavelength Counterparts Cata
VizieR,J/ApJS/221/12/table1,4842,"Mid-IR AGNs data ( Secrest N.J., Dudik R.P., Dorland B.N., Zacharias N., Makarov V., Fey A., Frouard J., Finch C.)"
VizieR,J/A+A/542/A48/ambredr1,4725,"Atmospheric Parameters and Chemical Abundances from Stellar Spectra, Version 1 ( Worley C.C., de Laverny P., Recio-Blanco A., Hill V., Bijaoui A., Ordenovic C.)"
VizieR,VII/240/mgczcat,4642,"*Millennium Galaxy Catalogue ( Liske J., Lemon D.J., Driver S.P., Cross N.J.G., Couch W.J.)"
VizieR,VII/241/2qz,4621,"2QZ catalogue: includes North and South galactic poles, and 6QZ with another 1657 lines. ( Croom S.M., Smith R.J., Boyle B.J., Shanks T., Miller L., Outram P.J., Loaring N.S.)"
VizieR,J/ApJ/753/121/table5,4563,"Spec-z and photo-z group galaxies ( Knobel C., Lilly S.J., Iovino A., et al.)"
VizieR,J/ApJ/680/169/table1,3950,"Catalog of virial mass measurements ( Shen Y., Greene J.E., Strauss M.A., Richards G.T., Schneider D.P.)"
VizieR,J/A+A/547/L1/table3,3893,"Damped Lyman-alpha absorption systems with logN(HI)>=20 ( Noterdaeme P., Petitjean P., Carithers W. C., et al.)"
HEASARC,sdssnbcqsc,3882,Sloan Digital Sky Survey NBC Quasar Candidate Catalog
VizieR,V/146/dr1,3875,"LAMOST DR1 catalog (31/03/2016 version) ( Luo A.-L., Zhao Y.-H., Zhao G., et al.)"
VizieR,IX/52/atcaclas,3681,"ATCA XXL-S source classification data (Paper XXXVI, Butler et al. 2019A&A...625A.111B) ( Chiappetti L., Pierre M., Adami C., et al.)"
VizieR,VIII/73/hicat,3643,"HI line data for 4315 extragalactic sources ( Meyer, M.J., Zwaan, M.A., Webster, R.L., et al.)"
VizieR,III/190B/web,3606,"Catalogue WEB (version 2, February 1996) ( Duflot M., Figon P., Meyssonnier N.)"
VizieR,J/MNRAS/462/3146/hdr1all,3531,"HATLAS DR1 Catalogue all IDs ( Valiante E., Smith M.W.L., Eales S., Maddox S.J., Ibar E., Hopwood R., Dunne L., Cigan P.J., Dye S., Pascale E., Rigby E.E., Bourne N., Furlanetto C., Ivison R.J.)"
VizieR,J/A+A/559/A14/f10wide,3396,"Search in F10_WIDE field AND MagI between -100 and 100 AND Spectroscopic Redshift > 0 ( Le Fevre O., Cassata P., Cucciati O., et al.)"
VizieR,J/A+A/427/387/master,3394,"The Master catalogue, with comprehensive listings of detections from 7 surveys. Also lists 2 radio lobes if applicable. ( Flesch E., Hardcastle M.J.)"
VizieR,J/A+A/559/A14/f02deep,3373,"Search in F02_DEEP field AND MagI between -100 and 100 AND Spectroscopic Redshift > 0 ( Le Fevre O., Cassata P., Cucciati O., et al.)"
VizieR,J/other/AstBu/73.310/catalog,3164,"The isolated galaxy pair catalog ( Nottale L., Chamaraux P.)"
VizieR,IX/49/xxlaaoz,3117,"XXL AAOmega redshift catalogue ( Pierre M., Pacaud F., Adami C., et al.)"
VizieR,J/MNRAS/425/2116/table2,3110,"ACES redshift catalogue ( Cooper M.C., Yan R., Dickinson M., Juneau S., Lotz J.M., Newman J.A., Papovich C., Salim S., Walth G., Weiner B.J., Willmer C.N.A.)"
VizieR,J/MNRAS/410/860/table1,2954,"Properties of the NMF reconstructions (non-negative matrix factorization) and the resulting broad absorption properties ( Allen J.T., Hewett P.C., Maddox N., Richards G.T., Belokurov V.)"
VizieR,J/A+A/588/A14/table2,2920,"Catalog of combined dataset galaxies ( Tempel E., Kipper R., Tamm A., Gramann M., Einasto M., Sepp T., Tuvikene T.)"
VizieR,III/21/gcrv,2903,The General Catalogue of Stellar Radial Velocity ( Wilson R.E.)
VizieR,J/ApJS/219/29/table6,2893,"Spectroscopic catalog ( Momcheva I.G., Williams K.A., Cool R.J., Keeton C.R., Zabludoff A.I.)"
VizieR,IX/52/3xlsopts,2776,"The 3XLSSOPTS XXL-S multiwave catalogue (Paper XXVII Chiappetti et al. 2018A&A...620A..12C) ( Chiappetti L., Pierre M., Adami C., et al.)"
VizieR,J/MNRAS/481/1055/table5,2761,"Galaxy redshifts ( Haines C.P., Busarello G., Merluzzi P., Pimbblet K.A., Vogt F.P.A., Dopita M.A., Mercurio A., Grado A., Limatola L.)"
VizieR,III/272/ravedr4,2733,"RAVE catalog, DR4 ( Kordopatis G., Gilmore G., Steinmetz M., et al.)"
VizieR,J/A+AS/130/323/table3,2578,"Catalogue ( Vettolani G., Zucca E., Merighi R., et al.)"
VizieR,J/A+A/559/A14/f22wide,2567,"Search in F22_WIDE field AND MagI between -100 and 100 AND Spectroscopic Redshift > 0 ( Le Fevre O., Cassata P., Cucciati O., et al.)"
VizieR,J/ApJ/858/77/table3,2481,"List of spectral identifications ( Hasinger G., Capak P., Salvato M., Barger A.J., Cowie L.L., Faisst A., Hemmati S., Kakazu Y., Kartaltepe J., Masters D., Mobasher B., Nayyeri H., Sanders D., Scoville N.Z., Suh H., Steinhardt C., Yang F.)"
VizieR,VII/99/catalog,2439,"Catalogue of radial velocities of galaxies ( Palumbo G.G.C., Tanzella-nitti G., Vettolani G.)"
VizieR,J/MNRAS/413/971/gamacore,2368,"Galaxy catalogue containing all SDSS galaxies within the GAMA regions, including GAMA-matched photometry and first year redshifts, GamaCoreDR1 ( Driver S.P., Hill D.T., Kelvin L.S., et al.)"
VizieR,III/47B/catalog,2277,Catalog Data ( Evans D.S.)
VizieR,J/ApJS/244/16/catalog,2254,"Hubble Legacy Fields (HLF) photometric catalog for the extended GOODS-South region; v2.0 release 60mas pixel scale mosaics ( Whitaker K.E., Ashas M., Illingworth G., Magee D., Leja J., Oesch P., van Dokkum P., Mowla L., Bouwens R., Franx M., Holden B., Labbe I., Rafelski M., Teplitz H., Gonzalez V.)"
VizieR,J/A+A/633/A154/cpz,2215,"CPz catalogue with object classifications ( Logan C.H.A., Fotopoulou S.)"
VizieR,J/MNRAS/457/110/catalog,2202,"Catalog ( Menzel M.-L., Merloni A., Georgakakis A., Salvato M., Aubourg E., Brandt W.N., Brusa M., Buchner J., Dwelly T., Nandra K., Paris I., Petitjean P., Schwope A.)"
VizieR,J/MNRAS/493/2745/dr14quv,2164,"GALEX UV data for SDSS DR14Q ( Vanden Berk D.E., Wesolowski S.C., Yeckley M.J., Marcinik J.M., Quashnock J.M., Machia L.M., Wu J.)"
VizieR,J/ApJ/877/81/table6,2159,"Redshift results ( Masters D.C., Stern D.K., Cohen J.G., Capak P.L., Stanford S.A., Hernitschek N., Galametz A., Davidzon I., Rhodes J.D., Sanders D., Mobasher B., Castander F., Pruett K., Fotopoulou S.)"
VizieR,J/ApJ/892/31/table6,2146,"Test results for 14828 sources ( Birky J., Hogg D.W., Mann A.W., Burgasser A.)"
VizieR,J/MNRAS/386/826/rv,2045,"Stellar radial velocities from the SMC 2dF survey ( Evans C.J., Howarth I.D.)"
VizieR,J/ApJ/850/66/table13,1957,"Catalog (final version, 21/08/2019) ( Ananna T.T., Salvato M., Lamassa S., et al.)"
VizieR,J/AJ/119/2598/table3,1940,"*Compiled data ( Sowards-Emmerd D., Smith J.A., McKay T.A., Sheldon E., Tucker D.L., Castander F.J.)"
VizieR,J/MNRAS/430/425/vlrslbg,1907,"Catalogue of LBGs ( Bielby R., Hill M.D., Shanks T., Crighton N.H.M., Infante L., Bornancini C.G., Francke H., Heraudeau P., Lambas D.G., Metcalfe N., Minniti D., Padilla N., Theuns T., Tummuangpak P., Weilbacher P.)"
VizieR,J/A+A/512/A12/catalogM,1888,"Combined table from original tables ( Balestra I., Mainieri V., Popesso P., Dickinson M., Nonino M., Rosati P., Teimoorinia H., Vanzella E., Cristiani S., Cesarsky C., Fosbury R.A.E., Kuntschner H., Rettura A.)"
VizieR,J/A+A/659/A183/tableb1,1781,"Catalog ( Kerutt J., Wisotzki L., Verhamme A., Schmidt K.B., Leclercq F., Herenz E.C., Urrutia T., Garel T., Hashimoto T., Maseda M., Matthee J., Kusakabe H., Schaye J., Richard J., Guiderdoni B., Mauerhofer V., Nanayakkara T., Vitte E.)"
VizieR,J/ApJ/756/74/table2,1623,"Sagittarius stellar velocity data ( Frinchaboy P.M., Majewski S.R., Munoz R.R., Law D.R., Lokas E.L., Kunkel W.E., Patterson R.J., Johnston K.V.)"
VizieR,J/MNRAS/398/109/iifsczv4,1609,"IIFSCz Catalogue (MRR+LW 18/04/09) ( Wang L., Rowan-Robinson M.)"
VizieR,IX/52/xxlaaoz,1523,"XXL_AAOmega_16 redshift table (Paper XXVII Chiappetti et al. 2018A&A...620A..12C) ( Chiappetti L., Pierre M., Adami C., et al.)"
VizieR,J/MNRAS/474/5363/table1,1509,"AKARI-SDSS-6dFGS-2MRS sample ( Kilerci Eser E., Goto T.)"
VizieR,J/ApJS/129/475/cnoc0223,1507,"CNOC2 Patch 0223+00 ( Yee H.K.C., Morris S.L., Lin H., Carlberg R.G., Hall P.B., Sawicki M., Patton D.R., Wirth G.D., Ellingson E., Shepherd C.W.)"
VizieR,J/MNRAS/464/1306/table10,1440,"Main LARGESS data table ( Ching J.H.Y., Sadler E.M., Croom S.M., Johnston H.M., Pracy M.B., Couch W.J., Hopkins A.M., Jurek R.J., Pimbblet K.A.)"
VizieR,VIII/77/table3,1410,"Properties of detected galaxies derived from spectra in digital archive ( Springob C.M., Haynes M.P., Giovanelli R., Kent B.R.)"
VizieR,J/ApJ/699/L43/catalog,1401,FIRST-NVSS-SDSS radio AGN sample catalog ( Smolcic V.)
VizieR,J/ApJ/691/1387/table2,1384,"Radial velocities and equivalent widths ( Rangwala N., Williams T.B., Stanek K.Z.)"
VizieR,J/A+A/654/A80/tableb1,1367,"Catalog of MUSE emission line sources studied in this work released with the paper ( Schmidt K.B., Kerutt J., Wisotzki L., et al.)"
VizieR,J/ApJS/258/29/table3,1335,"Non-AGN galaxies ( Chen Y.-P., Zaw I., Farrar G.R., Elgamal S.)"
VizieR,J/A+A/530/A31/table3,1277,"Parameters from the KISS pipeline for fields centered on 47 Tuc, M4, M12, M55, NGC 288, NGC 6752 ( Lane R.R., Kiss L.L., Lewis G.F., Ibata R.A., Siebert A., Bedding T.R., Szekely P., Szabo G.M.)"
VizieR,J/A+A/588/A14/table3,1247,"Catalog of 2mrs groups ( Tempel E., Kipper R., Tamm A., Gramann M., Einasto M., Sepp T., Tuvikene T.)"
HEASARC,morx,1202,Million Optical/Radio/X-Ray Associations Catalog
VizieR,J/MNRAS/372/425/catalog,1137,"The 2SLAQ redshift catalogue ( Cannon R., Drinkwater M., Edge A., et al.)"
VizieR,VII/223/2qz10k,1111,"List of object properties including position, identification and redshift ( Croom S.M., Smith R.J., Boyle B.J., Shanks T., Loaring N.S., Miller L., Lewis I.J.)"
VizieR,J/other/PASA/39.46/table2,1080,"Redshift, peculiar velocity and auxiliary information for 2285 SNe Ia and host galaxies ( Carr A., Davis T.M., Scolnic D., Said K., Brout D., Peterson E.R., Kessler R.)"
VizieR,V/153/dr4,1043,"LAMOST DR4 catalog (09/08/2018 version) ( Luo A.-L., Zhao Y.-H., Zhao G., et al.)"
VizieR,J/MNRAS/348/866/2dfngpgr,1043,"Group properties in the NGP ( Eke V.R., Baugh C.M., Cole S., et al.)"
VizieR,J/ApJ/720/368/table5,1041,"Relevant data for the sources in sample A ( Xue Y.Q., Brandt W.N., Luo B., Rafferty D.A., Alexander D.M., Bauer F.E., Lehmer B.D., Schneider D.P., Silverman J.D.)"
VizieR,II/333/master,1028,"SN candidates (Version April, 20 2018) ( Sako M., Bassett B., Becker A.C., et al.)"
HEASARC,arxa,1013,Atlas of Radio/X-Ray Associations (ARXA)
VizieR,J/MNRAS/437/2017/spectro2,976,"Spectroscopic catalogue of objects in the J1005, J1022 and J2218 fields ( Tejos N., Morris S.L., Finn C.W., Crighton N.H.M., Bechtold J., Jannuzi B.T., Schaye J., Theuns T., Altay G., Le Fevre O., Ryan-Weber E., Dave R.)"
VizieR,J/ApJS/121/287/cfa2s,972,"CfA survey radial velocities (tables 1 + 4) ( Huchra J.P., Vogeley M.S., Geller M.J.)"
VizieR,J/ApJ/684/1143/table1,964,"List of 10224 BHB candidates selected by color cut ( Xue X.X., Rix H.W., Zhao G., Re Fiorentin P., Naab T., Steinmetz M., van den Bosch F.C., Beers T.C., Lee Y.S., Bell E.F., Rockosi C., Yanny B., Newberg H., Wilhelm R., Kang X., Smith M.C., Schneider D.P.)"
VizieR,J/AJ/95/284/table1,957,"Redhsifts of galaxies in 14 fields ( Dressler A., Shectman S.A.)"
VizieR,J/AJ/153/114/table5,952,"Globular Cluster Radial Velocities (from Erratum, 2017, AJ, 154, 80) ( Forbes D.A., Alabi A., Brodie J.P., Romanowsky A.J., Strader J., Foster C., Usher C., Spitler L., Bellstedt S., Pastorello N., Villaume A., Wasserman A., Pota V.)"
VizieR,J/ApJ/888/78/catalog,939,"Data fields in the ACS-AGN catalog ( Stemo A., Comerford J.M., Barrows R.S., Stern D., Assef R.J., Griffith R.L.)"
VizieR,J/A+A/611/A53/table,921,"Catalog of VVDS data and new zReliability labels ( Jamal S., Le Brun V., Le Fevre O., Vibert D., Schmitt A., Surace C., Copin Y., Garilli B., Moresco M., Pozzetti L.)"
VizieR,J/A+A/559/A14/f02udeep,915,"Search in F02_UDEEP field AND MagI between -100 and 100 AND Spectroscopic Redshift > 0 ( Le Fevre O., Cassata P., Cucciati O., et al.)"
VizieR,J/MNRAS/450/3904/tablea1,913,"Catalog of C IV {lambda}{lambda}1548, 1551 Absorption Systems ( Chen Z.-F., Gu Q.-S., Chen Y.-M., Cao Y.)"
VizieR,J/ApJS/237/11/table6,910,"Galaxy redshift measurements ( Keeney B.A., Stocke J.T., Pratt C.T., Davis J.D., Syphers D., Danforth C.W., Shull J.M., Froning C.S., Green J.C., Penton S.V., Savage B.D.)"
VizieR,J/ApJS/167/1/table4,883,"Member Galaxies of Groups and Clusters for Samples Mr20, Mr19, and Mr18 ( Berlind A.A., Frieman J., Weinberg D.H., et al.)"
VizieR,J/A+A/569/A17/table2,876,"Positions, BV photometry, radial velocities and membership probabilities ( Cantat-Gaudin T., Vallenari A., Zaggia S., et al.)"
VizieR,J/MNRAS/480/707/s82cat,875,"S82 cross-matched catalogue ( Prescott M., Whittam I. H., Jarvis M. J., McAlpine K., Richter L. L., Fine S., Mauch T., Heywood I., Vaccari M.)"
VizieR,J/MNRAS/415/2336/hatlas,866,"Spire catalogue ( Rigby E.E., Maddox S.J., Dunne L., et al.)"
HEASARC,spidersros,853,SDSS-IV/SPIDERS ROSAT-Based X-Ray Point Source Spectroscopic Cat
VizieR,J/AJ/105/1637/catalog,847,"Radial velocities } ( Huchra J., Latham D.W., Nicolaci da Costa L., Pellegrini P.S., Willmer C.N.A.)"
VizieR,J/A+A/654/A80/tablec1,825,"Catalog of UV emission line sources collected from the literature provided with the paper ( Schmidt K.B., Kerutt J., Wisotzki L., et al.)"
VizieR,J/MNRAS/348/866/2dfsgpgr,810,"Group properties in the SGP ( Eke V.R., Baugh C.M., Cole S., et al.)"
VizieR,J/MNRAS/443/1999/cosmos,810,"Data for Chandra COSMOS ( Brightman M., Nandra K., Salvato M. Hsu L.-T., Aird J., Rangel C.)"
VizieR,J/ApJ/783/52/table1,804,"Redshifts in the field of A383 ( Geller M.J., Hwang H.S., Diaferio A., Kurtz M.J., Coe D., Rines K.J.)"
VizieR,J/ApJS/219/8/gal,802,"SDSS and WISE galaxies catalog ( Chang Y.-Y., van der Wel A., da Cunha E., Rix H.-W.)"
VizieR,J/A+A/566/A1/galaxies,800,"Table of galaxies (m_r_<=17.77, z<=0.2) ( Tempel E., Tamm A., Gramann M., Tuvikene T., Liivamagi L. J., Suhhonenko I., Kipper R., Einasto M., Saar E.)"
VizieR,J/ApJ/841/111/table3,786,"Keck spectroscopic results ( Masters D.C., Stern D.K., Cohen J.G., Capak P.L., Rhodes J.D., Castander F.J., Paltani S.)"
VizieR,J/ApJ/602/685/table6,780,"NGC 5128 planetary nebula positions and velocities ( Peng E.W., Ford H.C., Freeman K.C.)"
VizieR,J/ApJ/652/1585/table12,777,"""Non-metal-poor"" objects ( Frebel A., Christlieb N., Norris J.E., Beers T.C., Bessell M.S., Rhee J., Fechner C., Marsteller B., Rossi S., Thom C., Wisotzki L., Reimers D.)"
VizieR,J/A+A/575/A40/catalog,774,"Spectroscopic redshifts acquired using the ESO VLT/FORS2 facility ( Comparat J., Richard J., Kneib J.-P., et al.)"
VizieR,J/A+A/632/A36/table2,765,"Full redshift catalogue ( Caminha G.B., Rosati P., Grillo C., et al.)"
VizieR,J/other/Ap/52.40/fss,760,"Optical and near-infrared database of FSS galaxies ( Hakobyan A.A., Petrosian A.R., Mamon G.A., McLean B., Kunth D., Turatto M., Cappellaro E., Mannucci F., Allen R.J., Panagia N., Della Valle M.)"
VizieR,VII/36/catalog,755,The catalogue of Galaxy Redshifts ( Rood H.J.)
VizieR,J/MNRAS/274/1071/table3,750,"The galaxies observed in the EM cluster redshift survey ESO and AAT ( Collins C.A., Guzzo L., Nichol R.C., Lumsden S.L.)"
VizieR,J/ApJ/878/11/table1,739,"Source catalog (table sent by the author) ( Zou F., Yang G., Brandt W.N., Xue Y.)"
VizieR,J/A+A/652/A12/table3,726,"The new X-CLASS catalogue (table 3) ( Koulouridis E., Clerc N., Sadibekova T., et al.)"
VizieR,J/A+A/618/A137/tabled,722,"Atlas of CSGs from the MCs and interlopers ( Dorda R., Negueruela I., Gonzalez-Fernandez C., Marco A.)"
VizieR,J/ApJ/821/8/table2,712,"Sources that show no variation in radial velocity between multiple observations (1927 unique sources) ( Kounkel M., Hartmann L., Tobin J.J., Mateo M., Bailey III J.I., Spencer M.)"
VizieR,J/ApJ/883/175/table4,710,"The GOODVISITS table ( Yan R., Chen Y., Lazarz D., et al.)"
VizieR,J/A+A/513/A52/tableb1,691,"Globular Cluster velocities ( Schuberth Y., Richtler T., Hilker M., Dirsch B., Bassino L.P., Romanowsky A.J., Infante L.)"
VizieR,J/ApJ/756/139/table2,678,"Spectroscopic redshifts ( Connelly J.L., Wilman D.J., Finoguenov A., Hou A., Mulchaey J.S., McGee S.L., Balogh M.L., Parker L.C., Saglia R., Henderson R.D.E., Bower R.G.)"
HEASARC,rasssdssgc,677,ROSAT All-Sky Survey and Sloan Digital Sky Survey DR7 Galaxy Clu
VizieR,J/ApJ/834/210/table3,676,"The VLT/Magellan spectroscopic redshifts of the cluster members ( Carrasco M., Barrientos L.F., Anguita T., Garcia-Vergara C., Bayliss M., Gladders M., Gilbank D., Yee H.K.C., West M.)"
VizieR,J/ApJ/698/819/table1,670,"Catalog of selected SDSS DR5 MgII systems ( Lundgren B.F., Brunner R.J., York D.G., Ross A.J., Quashnock J.M., Myers A.D., Schneider D.P., Alsayyad Y., Bahcall N.)"
VizieR,J/A+A/559/A14/f14wide,665,"Search in F14_WIDE field AND MagI between -100 and 100 AND Spectroscopic Redshift > 0 ( Le Fevre O., Cassata P., Cucciati O., et al.)"
VizieR,J/PAZh/34/868/table,655,Clump red giants in Tycho-2 catalogue ( Gontcharov G.A.)
VizieR,J/MNRAS/427/2647/table2,654,"Spectral types and radial velocities of targets observed with the VLT ( McDonald I., White J.R., Zijlstra A.A., Guzman Ramirez L., Szyszka C., van Loon J.T., Lagadec E., Jones O.C.)"
VizieR,J/other/RAA/11.245/table5,641,"Properties of the galaxies in the field of RX J0054.0-2823 ( Giraud E., Gu Q.-S., Melnick J., Quintana H., Selman F., Toledo I., Zelaya P.)"
VizieR,J/ApJ/661/L155/table1,641,"Radial Velocity Measurements ( Pancino E., Galfo A., Ferraro F.R., Bellazzini M.)"
VizieR,J/A+A/624/A141/emobj,637,"Emission line object table ( Urrutia T., Wisotzki L., Kerutt J., et al.)"
VizieR,J/ApJS/240/39/table7,636,"DEIMOS spectroscopic survey catalog ( Golovich N., Dawson W.A., Wittman D.M., Jee M.J., Benson B., Lemaux B.C., van Weeren R.J., Andrade-Santos F., Sobral D., de Gasperin F., Bruggen M., Bradac M., Finner K., Peter A.)"
VizieR,J/MNRAS/483/5554/catalog,631,"Extragalactic X-ray source catalogue ( Earnshaw H.P., Roberts T.P., Middleton M.J., Walton D.J., Mateos S.)"
VizieR,J/MNRAS/461/248/tableb1,619,"Full spectroscopic catalogue ( Sifon C., Battaglia N., Hasselfield M., et al.)"
VizieR,J/ApJ/807/178/table4,603,"Newly identified rich clusters at high redshifts ( Wen Z.L., Han J.L.)"
VizieR,J/ApJS/250/3/table1,601,"Catalog of Mg II absorption line systems ( Chen Z.-F., Qin H.-C., Gui R.-J., Yi S.-X., Chen Z.-G., Gao Y.-C., Pang T.-T., Mo X.-H.)"
VizieR,J/MNRAS/224/453/table3,592,"Velocity sample for the clusters ( Colless M., Hewett P.)"
VizieR,J/MNRAS/468/2645/table2,575,"Full data table for heliocentric radial velocities in a 2-degree region around Abell 3266 ( Dehghan S., Johnston-Hollitt M., Colless M., Miller R.)"
VizieR,J/A+A/633/A159/tablea1,569,"Full MUSE redshift catalogue ( Rosani G., Caminha G.B., Caputi K.I., Deshmukh S.)"
VizieR,V/70A/catalog,568,"The Catalogue ( GLIESE W., JAHREISS H.)"
VizieR,J/ApJ/784/170/table4,567,"List of 6036 K giants selected from SDSS DR9 ( Xue X.-X., Ma Z., Rix H.-W., Morrison H.L., Harding P., Beers T.C., Ivans I.I., Jacobson H.R., Johnson J., Lee Y.S., Lucatello S., Rockosi C.M., Sobeck J.S., Yanny B., Zhao G., Allende Prieto C.)"
VizieR,J/ApJ/903/139/tabled1,567,"COSMOS-XS Multi-wavelength and AGN catalog ( Algera H.S.B., van der Vlugt D., Hodge J.A., Smail I.R., Novak M., Radcliffe J.F., Riechers D.A., Rottgering H., Smolcic V., Walter F.)"
