TAP_service,table_name,objects,description
VizieR,J/MNRAS/449/1536/table1,4,"The observed prism sample ( Turnshek D.A., Monier E.M., Rao S.M., Hamilton T.S., Sardane G.M., Held R.)"
VizieR,J/ApJ/850/181/table2,4,"Galaxy data ( Rudnick G., Jablonka P., Moustakas J., Aragon-Salamanca A., Zaritsky D., Jaffe Y.L., De Lucia G., Desai V., Halliday C., Just D., Milvang-Jensen B., Poggianti B.)"
VizieR,J/ApJ/859/53/table1,4,"Major properties of the MUSE medium-deep fields ( Marino R. A., Cantalupo S., Lilly S.J., et al.)"
VizieR,J/PASP/122/261/table1,4,"The Herschel Reference Sample ( Boselli A., Eales S., Cortese L., et al.)"
VizieR,J/MNRAS/381/211/table3,4,"Redshifts and radio flux densities for 2SLAQ LRGs which are detected as radio sources ( Sadler E.M., Cannon R.D., Mauch T., Hancock P.J., Wake D.A., Ross N., Croom S.M., Drinkwater M.J., Edge A.C., Eisenstein D., Hopkins A.M., Johnston H.M., Nichol R., Pimbblet K.A., De Propris R., Roseboom I.G., Schneider D.P., Shanks T.)"
VizieR,J/AJ/111/645/table1,4,"Morphology of objects listed by Green et al. (1986ApJS...61..305G, see cat. <II/207>) ( Fabian D., Usher P.D.)"
VizieR,J/AJ/123/1200/table3,4,"Cluster and Group Candidates Identified in Aquarius Region ( Caretta C.A., Maia M.A.G., Kawasaki W., Willmer C.N.A.)"
VizieR,J/ApJ/791/128/table16,4,"Galaxy Group Members near PHL 1811 (z_abs = 0.13280) ( Stocke J.T., Keeney B.A., Danforth C.W., Syphers D., Yamamoto H., Shull J.M., Green J.C., Froning C., Savage B.D., Wakker B., Kim T.-S., Ryan-Weber E.V., Kacprzak G.G.)"
VizieR,J/ApJ/888/85/table1,4,Ghostly absorbers ( Fathivavsari H.)
VizieR,J/MNRAS/413/971/extra,4,"Galaxy catalogue containing the same columns as GamaCoreDR1, for all objects that are not within the r band survey limit, GamaCoreExtraDR1 ( Driver S.P., Hill D.T., Kelvin L.S., et al.)"
VizieR,J/A+A/602/A28/table3,4,"List of non-dwarf galaxies with IR signatures of active massive black holes ( Marleau F.R., Clancy D., Habas R., Bianconi M.)"
VizieR,J/MNRAS/395/255/galaxies,4,"Combined table from original tables ( McConnachie A.W., Patton D.R., Ellison S.L., Simard L.)"
HEASARC,chansexagn,4,Chandra Serendipitous Extragalactic X-Ray Source ID (SEXSI)/Spit
VizieR,J/A+A/523/A7/table9,4,"List of SNLS 3 years type Ia supernova sample with coordinates of SNe in focal plane ( Guy J., Sullivan M., Conley A., et al.)"
VizieR,J/ApJ/819/114/table7,4,"MACS J0416.1-2403 Multiple Image Systems ( Kawamata R., Oguri M., Ishigaki M., Shimasaku K., Ouchi M.)"
HEASARC,noras,4,Northern ROSAT All-Sky (NORAS) Galaxy Cluster Survey Catalog
VizieR,J/PASP/125/2/catalog,4,"Overlapping galaxy pairs ( Keel W.C., Manning A.M., Holwerda B.W., Mezzoprete M., Lintott C.J., Schawinski K., Gay P., Masters K.L.)"
VizieR,J/ApJ/686/749/table11,4,"Supernovae of the Union compilation ( Kowalski M., Rubin D., Aldering G., et al.)"
VizieR,J/A+A/638/A45/table2,4,"General properties of the red AGN sample ( Masoura V.A., Georgantopoulos I., Mountrichas G., Vignali C., Koulouridis E., Chiappetti L., Fotopoulou S., Paltani S., Pierre M.)"
VizieR,J/A+A/530/A33/samples,4,"Samples of DLA systems ( Vladilo G., Abate C., Yin J., Cescutti G., Matteucci F.)"
VizieR,J/AJ/131/84/table2,4,"AGN and host galaxy information ( Vanden Berk D.E., Shen J., Yip C.-W., Schneider D.P., Connolly A.J., Burton R.E., Jester S., Hall P.B., Szalay A.S., Brinkmann J.)"
VizieR,J/ApJ/738/136/table4,4,"GALEX spectral sample identifications: CDFS 00 ( Cowie L.L., Barger A.J., Hu E.M.)"
VizieR,J/PASJ/70/S36/table2,4,"Results of SED fits ( Terashima Y., Suganuma M., Akiyama M., Greene J.E., Kawaguchi T., Iwasawa K., Nagao T., Noda H., Toba Y., Ueda Y., Yamashita T.)"
VizieR,J/ApJ/671/1227/table1,4,"Spectroscopic properties of the sample ( Dawson S., Rhoads J.E., Malhotra S., Stern D., Wang J., Dey A., Spinrad H., Jannuzi B.T.)"
HEASARC,tevcat,4,TeV Gamma-Ray Source Catalog
VizieR,J/PAZh/35/10/tables,4,"Parameters of the ""observed""  and ""intrinsic"" sample ( Badjin D.A., Beskin G.M., Greco G.)"
VizieR,J/ApJ/859/101/fullz,4,"The Pantheon with updated heliocentric redshifts (from lcparam_full_long_zhel.txt) ( Scolnic D.M., Jones D.O., Rest A., et al.)"
VizieR,J/ApJ/697/1369/south,4,"KGOODS-S v1.0 matched catalog, 08/02/2009 ( Bundy K., Fukugita M., Ellis R.S., Targett T.A., Belli S., Kodama T.)"
VizieR,J/ApJS/227/3/table4,4,"Giant arc redshift constraints ( Bayliss M.B., Ruel J., Stubbs C.W., et al.)"
VizieR,J/ApJ/665/921/table1,4,"Objects at z>2.5 in the A1689 Field ( Frye B.L., Coe D., Bowen D.V., Benitez N., Broadhurst T., Guhathakurta P., Illingworth G., Menanteau F., Sharon K., Lupton R., Meylan G., Zekser K., Meurer G., Hurley M.)"
VizieR,J/ApJ/905/93/table4,4,"Cross-validation results ( Hosseinzadeh G., Dauphin F., Villar V.A., et al.)"
VizieR,J/MNRAS/347/837/table1,4,"The SUMSS-NVSS ultra-steep spectrum (USS) sources ( De Breuck C., Hunstead R.W., Sadler E.M., Rocca-Volmerange B., Klamer I.)"
VizieR,J/A+A/567/A89/table1,4,"Cluster sample ( Tozzi P., Moretti A., Tundo E., Liu T., Rosati P., Borgani S., Tagliaferri G., Campana S., Fugazza D., D'Avanzo P.)"
VizieR,J/MNRAS/296/839/pdf,4,"Phoenix Deep Field Data ( Hopkins A.M., Mobasher, B. Cram, L., Rowan-Robinson, M.)"
VizieR,J/A+A/620/A82/table1,4,"IDs, coordinates and redshifts of the SUPER targets ( Circosta C., Mainieri V., Padovani P., et al.)"
VizieR,J/MNRAS/352/1245/table3,4,"2dFGRS radio identifications ( Chan B.H.P., Cram L.E., Sadler E.M., Killeen N.E.B., Jackson C.A., Mobasher B., Ekers R.D.)"
VizieR,J/A+A/616/A114/tablea1,4,"QSOs in the P4 sample ( De Cicco D., Brandt W.N., Grier C.J., Paolillo M., Filiz Ak N., Schneider D.P., Trump J.R.)"
VizieR,J/MNRAS/483/1354/table5,3,"The IPS-MRC-1Jy sources from the Chhetri et al. (2018MNRAS.474.4937C) IPS sample that also appear in the MRC-1Jy sample ( Sadler E.M., Chhetri R., Morgan J., Mahony E.K., Jarrett T.H., Tingay S.)"
VizieR,J/ApJS/255/22/frii,3,"Fanaroff-Riley type II radio sources (Table 1) and model parameters (Table 4) ( Machalski J., Koziel-Wierzbowska D., Goyal A.)"
VizieR,J/ApJ/884/66/table1,3,"List of GRBs in the sample ( Gatkine P., Veilleux S., Cucchiara A.)"
VizieR,J/A+A/382/60/table2,3,"Spectroscopically-confirmed cluster members from Teague et al. (1990ApJS...72..715T) ( Duc P.-A., Poggianti B.M., Fadda D., Elbaz D., Flores H., Chanial P., Franceschini A., Moorwood A., Cesarsky C.)"
VizieR,J/PASJ/53/653/table3,3,"List of objects detected in the K'-band image ( Tamura N., Ohta K., Maihara T., Iwamuro F., Motohara K., Takata T., Iye M.)"
VizieR,J/ApJ/764/135/table3,3,"BL Lac spectral properties ( Shaw M.S., Romani R.W., Cotter G., Healey S.E., Michelson P.F., Readhead A.C.S., Richards J.L., Max-Moerbeck W., King O.G., Potter W.J.)"
VizieR,J/A+A/388/1/tablea1,3,"Redshifts obtained in the EIS0946-2029 field ( Hansen L., Olsen L.F., Jorgensen H.E.)"
VizieR,J/ApJ/701/1219/table4,3,"Photometric and spectroscopic catalog of objects in the field around HE0226-4110 ( Chen H.-W., Mulchaey J.S.)"
VizieR,J/A+A/555/A42/suppl210,3,"Supplementary sources, 2-10keV band ( Ranalli P., Comastri A., Vignali C., Carrera F.J., Cappelluti N., Gilli R., Puccetti S., Brandt W.N., Brunner H., Brusa M., Georgantopoulos I., Iwasawa K., Mainieri V.)"
VizieR,J/A+A/538/A120/usc,3,"List of SNe from the unified SN catalogue ( Lennarz D., Altmann D., Wiebusch C.)"
VizieR,J/MNRAS/435/482/table1,3,"DLA (damped Lyman {alpha}) Sample ( Jorgenson R.A., Murphy M.T., Thompson R.)"
VizieR,J/AZh/72/291/table1,3,"A complete sample of radio sources from the Zelenchukskii survey with fluxes S3.9>200mJy ( Gorshkov, A.G., Konnikova, V. K.)"
VizieR,J/ApJ/749/97/table1,3,"Multiple-image systems and candidates ( Zitrin A., Rosati P., Nonino M., et al.)"
VizieR,J/MNRAS/372/741/table3,3,"The full 100 microJy catalogue ( Simpson C., Martinez-Sansigre A., Rawlings S., Ivison R., Akiyama M., Sekiguchi K., Takata T., Ueda Y., Watson M.)"
VizieR,J/ApJS/122/51/table2,3,"Properties of the clusters ( Dressler A., Smail I., Poggianti B.M., Butcher H., Couch W.J., Ellis R.S., Oemler A.Jr)"
VizieR,J/ApJS/179/95/xsources,3,"Combined table from original tables ( Mainieri V., Kellermann K.I., Fomalont E.B., Miller N., Padovani P., Rosati P., Shaver P., Silverman J., Tozzi P., Bergeron J., Hasinger G., Norman C., Popesso P.)"
VizieR,J/AN/338/700/table6,3,"Blazar and some parameters ( Mingaliev M.G., Sotnikova Yu.V., Mufakharov T.V., Nieppola E., Tornikoski M., Tammi J., Lahteenmaki A., Udovitskiy R.Yu., Erkenov A.K.)"
VizieR,J/ApJ/888/92/table1,3,"Observations ( Larson K.L., Diaz-Santos T., Armus L., Privon G.C., Linden S.T., Evans A.S., Howell J., Charmandaris V., U. V, Sanders D.B., Stierwalt S., Barcos-Munoz L., Rich J., Medling A., Cook D., Oklopcic A., Murphy E.J., Bonfini P.)"
HEASARC,exopubs,3,EXOSAT Bibliography
VizieR,J/ApJ/704/1405/table1,3,"General properties of BAT/WAM bursts ( Krimm H.A., Yamaoka K., Sugita S., Ohno M., Sakamoto T., Barthelmy S.D., Gehrels N., Hara R., Norris J.P., Ohmori N., Onda K., Sato G., Tanaka H., Tashiro M., Yamauchi M.)"
VizieR,J/PASP/132/K4102/table1,3,"Fermi Blazars ( Pei Z., Fan J., Yang J., Bastieri D.)"
VizieR,J/AJ/112/62/table2,3,"Damped Ly{alpha} sample ( Tanner A.M., Bechtold J., Walker C.E., Black J.H., Cutri R.M.)"
VizieR,J/A+A/491/379/table1,3,"Velocity catalog of 293 spectroscopically measured galaxies in the field of A520 ( Girardi M., Barrena R., Boschin W., Ellingson E.)"
VizieR,J/A+A/363/141/table2,3,"Repeated observations ( Reich W., Fuerst E., Reich P., Kothes R., Brinkmann W., Siebert J.)"
VizieR,J/A+A/648/A122/catalog,3,"Binary morphology SDSS galaxies catalog ( Vavilova I.B., Dobrycheva D.V., Vasylenko M.Yu., Elyiv A.A., Melnyk O.V., Khramtsov V.)"
VizieR,J/ApJ/730/19/agn,3,"Spectroscopic properties and SEDs of AGNs ( Sargsyan L., Weedman D., Lebouteiller V., Houck J., Barry D., Hovhannisyan A., Mickaelian A.)"
VizieR,J/ApJ/905/93/table5,3,"Rare transients ( Hosseinzadeh G., Dauphin F., Villar V.A., et al.)"
VizieR,J/AJ/140/119/table4,3,"RV data of probable young candidates (PYCs) ( Schlieder J.E., Lepine S., Simon M.)"
VizieR,J/A+A/620/A68/table3,3,"Polarization data ( Hutsemekers D., Borguet B., Sluse D., Pelgrims V.)"
VizieR,J/MNRAS/439/690/blazars,3,"The blazar samples ( Hovatta T., Pavlidou V., King O.G., Mahabal A., Sesar B., Dancikova R., Djorgovski S.G., Drake A., Laher R., Levitan D., Max-Moerbeck W., Ofek E.O., Pearson T.J., Prince T.A., Readhead A.C.S., Richards J.L., Surace J.)"
VizieR,J/ApJ/684/136/table1,3,"Multiwavelength properties of the 15um sources in the ELAIS-S1 field (from erratum in 2009ApJ...701..850G) ( Gruppioni C., Pozzi F., Polletta M., Zamorani G., La Franca F., Sacchi N., Comastri A., Pozzetti L., Vignali C., Lonsdale C., Rowan-Robinson M., Surace J., Shupe D., Fang F., Matute I., Berta S.)"
VizieR,J/ApJ/746/156/table1,3,"Master table ( Chandra P., Frail D.A.)"
VizieR,J/ApJS/194/29/table4,3,"Program source data ( Richards J.L., Max-Moerbeck W., Pavlidou V., et al.)"
HEASARC,saxhellasr,3,BeppoSAX High-Energy Large Area Survey (HELLAS) Radio Source Cat
VizieR,J/PASP/97/932/3cr,3,"The catalog ( Spinrad. H, Djorgovski S., Marr J., Aguilar L.)"
VizieR,J/ApJ/618/123/table4,3,"Hard X-ray emitting AGN ( Silverman J.D., Green P.J., Barkhouse W.A., Kim D.-W., Aldcroft T.L., Cameron R.A., Wilkes B.J., Mossman A., Ghosh H., Tananbaum H., Smith M.G., Smith R.C., Smith P.S., Foltz C., Wik D., Jannuzi B.T.)"
VizieR,J/ApJ/697/207/table2,3,"Spectra of GD-1 stream candidates ( Willett B.A., Newberg H.J., Zhang H., Yanny B., Beers T.C.)"
VizieR,J/ApJS/243/14/table2,3,"The Ogle et al. Galaxy Catalog (OGC) ( Ogle P.M., Lanz L., Appleton P.N., Helou G., Mazzarella J.)"
VizieR,J/A+AS/135/571/table4,3,"Polarization properties at 6.3cm (N=154 sources) ( Zukowski E.L.H., Kronberg P.P., Forkert T., Wielebinski R.)"
VizieR,J/ApJ/708/584/table2,3,"SEXSI-Spitzer catalog ( Eckart M.E., McGreer I.D., Stern D., Harrison F.A., Helfand D.J.)"
VizieR,J/MNRAS/430/3086/tablea5,3,"Revised redshift for sources in the CoNFIG catalogue ( Gendre M.A., Best P.N., Wall J.V., Ker L.M.)"
VizieR,J/ApJ/761/125/table1,3,"Sample for blazars ( Fan J.H., Yang J.H., Yuan Y.H., Wang J., Gao Y.)"
VizieR,J/A+A/530/A21/table5,3,"Spectral parameters of the Fermi/GBM GRBs collected from the GCN Circular Archive ( Nava L., Ghirlanda G., Ghisellini G., Celotti A.)"
VizieR,J/A+A/652/A23/table1,3,"IR line fluxes for star-forming galaxies ( Fernandez-Ontiveros J.A., Perez-Montero E., Vilchez J.M., Amorin R., Spinoglio L.)"
VizieR,J/ApJS/191/124/table7,3,"Redshifts for X-ray sources solely detected in the 1-2Ms catalogs ( Silverman J.D., Mainieri V., Salvato M., et al.)"
VizieR,J/A+A/449/425/table1,3,"A catalog of Hamburg/ROSAT-FSC identifications for {delta}>0, |b|>30 and X-ray counts>0.04ct/s: 3202 objects for 2696 ROSAT sources. ( Mickaelian A.M., Hovhannisyan L.R., Engels D., Hagen H.-J., Voges W.)"
VizieR,J/ApJS/233/20/table6,3,"Cross-identified sources around the CGM-MASS galaxies ( Li J.-T., Bregman J.N., Wang Q.D., Crain R.A., Anderson M.E., Zhang S.)"
VizieR,J/ApJS/97/1/table1,3,"Objects, velocities, and column densities ( Lockman F.J., Savage B.D.)"
VizieR,J/AJ/159/103/table2,3,"The Hyper Suprime-Cam Subaru Strategic Program (HSC-SSP) dwarf-dwarf merger catalog (and non-detections) ( Kado-Fong E., Greene J.E., Greco J.P., Beaton R., Goulding A.D., Johnson S.D., Komiyama Y.)"
VizieR,J/ApJ/699/800/table3,3,"Basic properties of LBQS sources without black hole mass estimates ( Vestergaard M., Osmer P.S.)"
VizieR,J/AJ/130/1345/table2,3,"CORALS QSO magnitudes ( Ellison S.L., Hall P.B., Lira P.)"
VizieR,J/ApJ/746/85/table1,3,"Supernova from the HST Cluster Supernova Survey ( Suzuki N., Rubin D., Lidman C., et al.)"
VizieR,J/MNRAS/318/333/table1,3,"The low-flux extension to the ROSAT Brightest Cluster Sample ( Ebeling H., Edge A.C., Allen S.W., Crawford C.S., Fabian A.C., Huchra J.P.)"
VizieR,J/ApJ/653/127/table1,3,"Source Characteristics ( Shi Y., Rieke G.H., Hines D.C., Gorjian V., Werner M.W., Cleary K., Low F.J., Smith P.S., Bouwman J.)"
VizieR,J/A+A/566/A24/table2,3,"Intervening extremely strong damped Lymna-{alpha} systems (ESDLA) sample ( Noterdaeme P., Petitjean P., Paris I., Cai Z., Finley H., Ge J., Pieri M.M., York D.G.)"
VizieR,J/A+A/534/A109/mcxc,3,"MCXC catalogue (table2 of the paper) ( Piffaretti R., Arnaud M., Pratt G.W., Pointecouteau E., Melin J.-B.)"
VizieR,J/ApJ/646/133/table2,3,"Group properties ( Mulchaey J.S., Lubin L.M., Fassnacht C., Rosati P., Jeltema T.E.)"
VizieR,J/ApJS/219/18/nondet,3,"Fluxes of 24um-selected  Herschel-non-detected type-1 and type-2 AGN sample ( Xu L., Rieke G.H., Egami E., Pereira M.J., Haines C.P., Smith G.P.)"
VizieR,J/AJ/139/2525/catalog,3,"UNAM-KIAS sample of Isolated Galaxies ( Hernandez-Toledo H.M., Vazquez-Mata J.A., Martinez-Vazquez L.A., Choi Y.-Y., Park C.)"
VizieR,J/A+AS/126/519/table1,3,"Catalog elements for program galaxies ( Simien F., Prugniel P.)"
VizieR,J/MNRAS/399/2231/catalog,3,"DR5 meta-catalogue (1.7<z<4.2) ( Scaringi S., Cottis C., Knigge C., Goad M.)"
VizieR,J/A+A/569/A52/tablea1,3,"325MHz GMRT observations of the Ultra Steep Spectrum (USS) sample ( Singh V., Beelen A., Wadadekar Y., Sirothia S., Ishwara-Chandra C.H., Basu A., Omont A., McAlpine K., Ivison R.J., Oliver S., Farrah D., Lacy M.)"
VizieR,J/AJ/131/2018/table1,3,"Physical parameters and median errors of the objects in our sample that are not obvious superpositions ( Bernardi M., Sheth R.K., Nichol R.C., Miller C.J., Schlegel D., Frieman J., Schneider D.P., Subbarao M., York D.G., Brinkmann J.)"
HEASARC,pdsoid,3,Phoenix Deep Survey Optical and Near-Infrared Counterparts Catal
VizieR,J/MNRAS/470/95/macs0329,3,"MACS J0329-02 photometric redshift catalogue ( Molino A., Benitez N., Ascaso B., et al.)"
VizieR,J/A+A/566/A140/table1,3,"Catalog of XMM X-ray galaxy groups in CFHTLS-W1 ( Gozaliasl G., Finoguenov A., Khosroshahi H.G., et al.)"
VizieR,J/A+A/589/A97/table1,3,"PDS parameters of a sample of 123 long GRBs ( Dichiara S., Guidorzi C., Amati L., Frontera F., Margutti R.)"
VizieR,J/MNRAS/434/772/table1,3,"Radial velocities of 128 galaxies in the field of ZwCl 2341+00 ( Boschin W., Girardi M., Barrena R.)"
VizieR,J/ApJS/155/271/table4,3,"Optical spectroscopy results ( Szokoly G.P., Bergeron J., Hasinger G., Lehmann I., Kewley L., Mainieri V., Nonino M., Rosati P., Giacconi R., Gilli R., Gilmozzi R., Norman C., Romaniello M., Schreier E., Tozzi P., Wang J.X., Zheng W., Zirm A.)"
VizieR,J/ApJ/736/86/table1,3,"Optical continuum and emission-line parameters of the full sample ( Dong X.-B., Wang J.-G., Ho L.C., Wang T.-G., Fan X., Wang H., Zhou H., Yuan W.)"
VizieR,J/MNRAS/382/1342/table2,3,"*Bound and unbound compact stellar systems (CSS) ( Firth P., Drinkwater M.J., Evstigneeva E.A., Gregg M.D., Karick A.M., Jones J.B., Phillipps S.)"
VizieR,J/ApJ/819/63/table4,3,"Dynamical masses and SZ signals of clusters ( Rines K.J., Geller M.J., Diaferio A., Hwang H.S.)"
VizieR,J/MNRAS/444/2456/tablea1,3,"SGP (Spectral Galaxy Paris) sample selected from SDSS DR9 ( Yang H., Luo A., Chen X., Zhang J., Hou W., Cai J., Wei P., Ren J., Liu X., Zhao Y.)"
VizieR,J/MNRAS/481/4158/tablea1,3,"Parameters of 45 clusters with known mass (M500) from literature ( Wen Z.L., Han J.L.)"
VizieR,J/ApJ/738/69/table1,3,"Photometry of galaxies at 3.8<z<5.0 ( Shim H., Chary R.-R., Dickinson M., Lin L., Spinrad H., Stern D., Yan C.-H.)"
VizieR,J/MNRAS/381/1369/table3,3,"Spectroscopic targets with total z'-band magnitudes and cross-correlated redshifts ( Geach J.E., Simpson C., Rawlings S., Read A.M., Watson M.)"
VizieR,J/ApJ/911/82/table2,3,"Galaxy cluster gas mass fractions ( Corasaniti P.-S., Sereno M., Ettori S.)"
VizieR,J/ApJ/890/148/table2,3,"Cluster properties and weak-lensing measurements ( Umetsu K., Sereno M., Lieu M., et al.)"
VizieR,J/MNRAS/471/4990/tablea1,3,"X-ray to optical properties of individual galaxies ( Caglar T., Hudaverdi M.)"
VizieR,J/ApJS/175/29/table4,3,"QSO catalog corrections ( Marble A.R., Eriksen K.A., Impey C.D., Bai L., Miller L.)"
VizieR,J/MNRAS/440/1248/lrgdt1v,3,"Type1 voids from lrgdim in comoving coordinates ( Nadathur S., Hotchkiss S.)"
VizieR,J/ApJ/911/82/table1,3,"Galaxy clusters from the selected LC-single and HSC-XXL catalogs ( Corasaniti P.-S., Sereno M., Ettori S.)"
VizieR,J/ApJ/466/415/table,3,"Individual velocities ( Mazeh T., Latham D.W., Stefnik R.P.)"
VizieR,J/ApJ/859/116/table1,3,"Properties ( Kong M., Ho L.C.)"
VizieR,J/ApJS/218/10/table1,3,"List of observations and derived parameters of the HET Massive Galaxy Survey (HETMGS) ( van den Bosch R.C.E., Gebhardt K., Gultekin K., Yildirim A., Walsh J.L.)"
VizieR,J/AJ/135/1311/table12,3,"*Moderate redshift radio galaxy sub-sample with LRIS MOS observations (14 targets) (table1 and 2 of the paper) ( Auger M.W., Becker R.H., Fassnacht C.D.)"
VizieR,J/MNRAS/306/857/obs,3,"Observed clusters: includes the clusters in the BCS sample (table 1 of paper) and the clusters not included due to their faint X-ray flux, declination <0, or low Galactic latitude (table 2) ( Crawford C.S., Allen S.W., Ebeling H., Edge A.C., Fabian A.C.)"
VizieR,J/A+A/466/41/tabled1,3,"Optical data of additional objects ( Krumpe M., Lamer G., Schwope A.D., Wagner S., Zamorani G., Mignoli M., Staubert R., Wisotzki L., Hasinger G)"
VizieR,J/ApJ/870/31/table1,3,"The IR catalog of the Swift/BAT 70 month AGN survey ( Ichikawa K., Ricci C., Ueda Y., Bauer F.E., Kawamuro T., Koss M.J., Oh K., Rosario D.J., Shimizu T.T., Stalevski M., Fuller L., Packham C., Trakhtenbrot B.)"
HEASARC,markarian,2,First Byurakan Survey (Markarian) Catalog of UV-Excess Galaxies
VizieR,J/ApJ/778/128/grb,2,"GRB afterglow properties and host positions ( Perley D.A., Levan A.J., Tanvir N.R., Cenko S.B., Bloom J.S., Hjorth J., Kruhler T., Filippenko A.V., Fruchter A., Fynbo J.P.U., Jakobsson P., Kalirai J., Milvang-Jensen B., Morgan A.N., Prochaska J.X., Silverman J.M.)"
VizieR,J/MNRAS/371/898/table3,2,"Radio spectra and optical IDs for extragalactic 18GHz sources (|b|>10{deg}), and excluding objects within of the LMC centre ( Sadler E.M., Ricci R., Ekers R.D., Ekers J.A., Hancock P.J., Jackson C.A., Kesteven M.J., Murphy T., Phillips C., Reinfrank R.F., Staveley-Smith L., Subrahmanyan R., Walker M.A., Wilson W.E., De Zotti G.)"
HEASARC,uvqs,2,UV-Bright Quasar Survey (UVQS) DR1 Catalog
VizieR,J/ApJ/865/106/alma,2,"CDF-S band 7 ALMA >4.5{sigma} sources and redshift data (Tables 4 and 5) ( Cowie L.L., Gonzalez-Lopez J., Barger A.J., Bauer F.E., Hsu L.-Y., Wang W.-H.)"
VizieR,J/MNRAS/352/91/table2,2,"Optical and X-ray properties of the sample ( Georgantopoulos I., Georgakakis A., Akylas A., Stewart G.C., Giannakis O., Shanks T., Kitsionas S.)"
VizieR,J/A+A/407/791/c7,2,"7um sources detected in the field of Abell 370 ( Metcalfe L., Kneib J.-P., McBreen B., Altieri B., Biviano A., Delaney M., Elbaz D., Kessler M.F., Leech K., Okumura K., Ott S., Perez-Martinez R., Sanchez-Fernandez C., Schulz B.)"
VizieR,J/ApJ/641/169/table3,2,"Lens field galaxy properties ( Momcheva I., Williams K., Keeton C., Zabludoff A.)"
VizieR,J/A+A/569/A95/tablea2,2,"Main properties objects discussed in Heidt & Nilsson (2011, J/A+A/529/A162) and the present work ( Kuegler S.D., Nilsson K., Heidt J., Esser J., Schultz T.)"
VizieR,J/A+A/407/791/c15,2,"15um sources detected in the field of Abell 370 ( Metcalfe L., Kneib J.-P., McBreen B., Altieri B., Biviano A., Delaney M., Elbaz D., Kessler M.F., Leech K., Okumura K., Ott S., Perez-Martinez R., Sanchez-Fernandez C., Schulz B.)"
HEASARC,at20g1fgl,2,AT20G/Fermi 1FGL Source Catalog
VizieR,J/AJ/141/1/goods,2,"Spitzer and ancillary data in the GOODS North  and South fields ( Teplitz H.I., Chary R., Elbaz D., Dickinson M., Bridge C., Colbert J., Le Floc'h E., Frayer D.T., Howell J.H., Koo D.C., Papovich C., Phillips A., Scarlata C., Siana B., Spinrad H., Stern D.)"
VizieR,J/MNRAS/460/3202/tablea1,2,"Best-fitting parameters of the morphological fittings and general properties of the combined (this work and literature compilation) ( Olguin-Iglesias A., Leon-Tavares J., Kotilainen J.K., Chavushyan V., Tornikoski M., Valtaoja E., Anorve C., Valdes J., Carrasco L.)"
VizieR,J/A+A/666/A115/tablea1,2,"IR emission line fluxes for the of AGN and their references ( Perez-Diaz B., Perez-Montero E., Fernandez-Ontiveros J.A., Vilchez J.M.)"
VizieR,J/ApJS/146/267/table4,2,"Optical Identifications ( Morrison G.E., Owen F.N., Ledlow M.J., Keel W.C., Hill J.M., Voges W., Herter T.)"
VizieR,J/ApJ/887/23/table2,2,"X-ray properties and redshifts of the 850um ALMA from Paper III (Cowie+, 2018, J/ApJ/865/106) ( Barger A.J., Cowie L.L., Bauer F.E., Gonzalez-Lopez J.)"
VizieR,J/ApJ/580/774/table1,2,"Catalog of the 73 X-Ray brightest clusters from the CIZA survey (Clusters In the Zone of Avoidance) ( Ebeling H., Mullis C.R., Tully R.B.)"
VizieR,J/ApJ/897/177/table1,2,"Basic properties of 142 high-redshift blazars studied in this work ( Paliya V.S., Ajello M., Cao H.-M., Giroletti M., Kaur A., Madejski G., Lott B., Hartmann D.)"
VizieR,J/MNRAS/410/1262/tablea2,2,"Classifications and redshifts ( Walker E.S., Hook I.M., Sullivan M., et al.)"
HEASARC,intibisag2,2,INTEGRAL IBIS AGN Catalog Update
VizieR,J/ApJ/847/38/table12,2,"The blueberry galaxies properties (tables 1 and 2) ( Yang H., Malhotra S., Rhoads J.E., Wang J.)"
VizieR,J/A+A/520/A113/table4,2,"List of the 49 extragalactic radio sources not detected in one or both bands during EC025A and EC025B (7 sources out of 218 observed during EC025A and 42 sources out of 229 observed during EC025B) ( Bourda G., Charlot P., Porcas R.W., Garrington S.T.)"
VizieR,J/AJ/130/896/sgrs,2,"Observed and derived properties of the sampleof 18 giant SUMSS radio sources ( Saripalli L., Hunstead R.W., Subrahmanyan R., Boyce E.)"
VizieR,J/MNRAS/440/1248/bri2t2v,2,"Type2 voids from bright2 in comoving coordinates ( Nadathur S., Hotchkiss S.)"
VizieR,J/MNRAS/439/1648/table1,2,"Basic object properties and nuclear 12 & 18um continuum fluxes/ratios ( Asmus D., Hoenig S.F., Gandhi P., Smette A., Duschl W.J.)"
VizieR,J/A+AS/128/507/table2-4,2,"Names, coordinates, redshift, observing dates, B magnitudes and comments ( Engels D., Hagen H.-J., Cordis L., Koehler S., Wisotzki L., Reimers D.)"
VizieR,J/MNRAS/440/476/qsos,2,"The low-redshift QSO sample,  and the properties of their host galaxies ( Falomo R., Bettoni D., Karhunen K., Kotilainen J.K., Uslenghi M.)"
VizieR,J/ApJ/731/97/table1,2,"Variable nucleus galaxies in GOODS ( Sarajedini V.L., Koo D.C., Klesman A.J., Laird E.S., Perez Gonzalez P.G., Mozena M.)"
VizieR,J/ApJS/225/23/table3,2,"Catalog of MLCG members ( Sohn J., Geller M.J., Hwang H.S., Zahid H.J., Lee M.G.)"
VizieR,J/ApJ/811/93/table2,2,"GRB minimum timescales ( Golkhou V.Z., Butler N.R., Littlejohns O.M.)"
VizieR,J/ApJ/874/32/table2,2,"Data used for validation with Gupta+ (2011, J/ApJ/740/92) ages ( Rose B.M., Garnavich P.M., Berg M.A.)"
VizieR,J/MNRAS/253/686/table3,2,"The survey catalogue ( COLLESS M., ELLIS R.S., TAYLOR K., SHAW G.)"
VizieR,J/ApJ/780/34/table3,2,"Photometric catalog ( Lundgren B.F., van Dokkum P., Franx M., Labbe I., Trenti M., Bouwens R., Gonzalez V., Illingworth G., Magee D., Oesch P., Stiavelli M.)"
VizieR,J/MNRAS/482/2731/table1,2,"GRBs data used to estimate dust-to-metals ratios and N(Fe,Si)_dust_ ( Zafar T., Moller P.)"
VizieR,J/AJ/146/151/table6,2,"Morphology catalog including spectroscopic and photometric properties ( Oh K., Choi H., Kim H.-G., Moon J.-S., Yi S.K.)"
VizieR,J/A+A/646/A96/table1,2,"IDs, coordinates and redshifts of the targets ( Circosta C., Mainieri V., Lamperti I., et al.)"
VizieR,J/ApJS/164/307/catalog,2,"Radio and NICMOS properties of the 3CR sample ( Madrid J.P., Chiaberge M., Floyd D., Sparks W.B., Macchetto D., Miley G.K., Axon D., Capetti A., O'Dea C.P., Baum S., Perlman E., Quillen A.)"
VizieR,J/A+A/501/461/lens,2,"Spectroscopy, photometry, and lensing mass  measurements of the 57 early-type grade-A lens galaxies of  the SLACS survey ( Grillo C., Gobat R., Lombardi M., Rosati P.)"
